{
  "schema_version": "1.0.0",
  "workcell_id": "wc-42-20250115T143022Z",
  "issue_id": "42",
  "status": "success",
  "patch": {
    "branch": "wc/42/20250115T143022Z",
    "base_commit": "a1b2c3d4e5f6789012345678901234567890abcd",
    "head_commit": "z9y8x7w6v5u4321098765432109876543210zyxw",
    "diff_stats": {
      "files_changed": 4,
      "insertions": 156,
      "deletions": 23
    },
    "files_modified": [
      "src/api/auth.ts",
      "src/api/routes.ts",
      "src/middleware/rateLimit.ts",
      "tests/auth.test.ts"
    ],
    "forbidden_path_violations": []
  },
  "commands_executed": [
    {
      "command": "npm test -- --testPathPattern=auth",
      "exit_code": 0,
      "duration_ms": 4523,
      "stdout_path": ".workcells/wc-42-20250115T143022Z/logs/test-stdout.log",
      "stderr_path": ".workcells/wc-42-20250115T143022Z/logs/test-stderr.log"
    },
    {
      "command": "npm run lint",
      "exit_code": 0,
      "duration_ms": 1200
    },
    {
      "command": "npm run typecheck",
      "exit_code": 0,
      "duration_ms": 3100
    },
    {
      "command": "npm run build",
      "exit_code": 0,
      "duration_ms": 8900
    }
  ],
  "verification": {
    "gates": {
      "test": {
        "passed": true,
        "exit_code": 0,
        "duration_ms": 4523,
        "output_path": ".workcells/wc-42-20250115T143022Z/logs/test.log"
      },
      "lint": {
        "passed": true,
        "exit_code": 0,
        "duration_ms": 1200,
        "output_path": ".workcells/wc-42-20250115T143022Z/logs/lint.log"
      },
      "typecheck": {
        "passed": true,
        "exit_code": 0,
        "duration_ms": 3100,
        "output_path": ".workcells/wc-42-20250115T143022Z/logs/typecheck.log"
      },
      "build": {
        "passed": true,
        "exit_code": 0,
        "duration_ms": 8900,
        "output_path": ".workcells/wc-42-20250115T143022Z/logs/build.log"
      }
    },
    "all_passed": true,
    "blocking_failures": []
  },
  "artifacts": {
    "logs": [
      ".workcells/wc-42-20250115T143022Z/logs/"
    ],
    "test_report": ".workcells/wc-42-20250115T143022Z/test-report.json",
    "coverage_report": ".workcells/wc-42-20250115T143022Z/coverage/lcov-report/index.html",
    "agent_transcript": ".workcells/wc-42-20250115T143022Z/transcript.md"
  },
  "confidence": 0.92,
  "risk_classification": "medium",
  "risk_factors": [
    "Modifies authentication flow",
    "Adds new API endpoint",
    "Touches rate limiting middleware"
  ],
  "beads_mutations": [
    {
      "action": "close",
      "issue_id": "42"
    },
    {
      "action": "create",
      "new_issue": {
        "title": "Add auth rate limiting tests for edge cases",
        "description": "Discovered during implementation:\n- Need tests for concurrent requests from same IP\n- Need tests for rate limit reset behavior\n- Need tests for distributed rate limiting",
        "priority": "P2"
      }
    },
    {
      "action": "dep_add",
      "dep": {
        "from": "42",
        "to": "NEW",
        "type": "discovered"
      }
    }
  ],
  "follow_ups": [
    {
      "title": "Add auth rate limiting tests for edge cases",
      "description": "Need to test: concurrent requests, IP spoofing, distributed scenarios",
      "priority": "P2",
      "discovered_from": "42"
    },
    {
      "title": "Consider adding refresh token support",
      "description": "Current implementation only uses access tokens. May want refresh tokens for better UX.",
      "priority": "P3",
      "discovered_from": "42"
    }
  ],
  "metadata": {
    "toolchain": "codex",
    "toolchain_version": "1.2.3",
    "model": "o3",
    "started_at": "2025-01-15T14:30:22Z",
    "completed_at": "2025-01-15T14:52:18Z",
    "duration_ms": 1316000,
    "tokens_used": 47823,
    "cost_usd": 0.95
  }
}

